Text,Category
crowleysdemons es reading book suggests sitting quietly 10 minutes day seeing feelings come says basically theres lot sadness underneath sadness,True Positive
course rosy balan become supervising maestro test finished rosarioi wish good luck balan looks sorry tempos decision rosario feelings happiness sadness decision,True Negative
depression natural reaction serious loss depression individuals depressed often deny minimize problem signs amp symptoms vary dont always follow particular pattern include persistent sadness feelings hopelessness irritability,True Positive
emotional roller coaster everyones experience hearing loss different feelings include frustration embarrassment sadness two common psychological effects hearing impairment depression anxiety,True Positive
wanted eat someone nvm im going eat home im going relax watch tv set mind free feelings feelings random wave sadness got,True Positive
makes pathetic fact come admitting feelings sadness happy hate get always thinking everything okay cant hknest anyone hate,True Positive
sometimes read feelings expressions portrays music deep feels whether sadness pure joy literally gives us feels every single note word leave mark good way cool way,True Negative
feelings admitting failure experiencing regret lost love without falling cheap interpretations showing raw powerful emotions sadness solemnity freestyled yet controlled dance routine,True Positive
vitamin deficiency often causes feelings sadness hopelessness vitamin vital mental health essential physical health sufficient research show enough vitamin lead depressionlike symptoms,False Negative
njs governor chairman national governors association murphy launches effort bolster youth mental health 37 high school students reported poor mental health pandemic 44 reported persistent feelings sadness hopelessness acco,True Positive
know spending 5 minutes day nature significantly reduce anger feelings sadness bc parks rec 2020,True Positive
video evidence clamoring amp reimagining work live forever cries plunged major cities turmoil saddled unprecedented amp hopelessness,True Positive
finally say multiple days four different breakdowns feeling utter hopelessnessi finally finally downloaded ff7r,False Negative
depression natural reaction serious loss depression individuals depressed often deny minimize problem signs amp symptoms vary dont always follow particular pattern include persistent sadness feelings hopelessness irritability,True Positive
wouldve wanted dying family members isolation age would give sense hopelessness im sure health officials know,True Positive
resisting hopelessness hard work,True Positive
much say really bible though newbie ask people twitter everywhere give scripture specific things guilt shame hopelessness depression fear confusion feeling tired anxious whatever,True Positive
oloriibu abirungbọn bii ẹni singbado see youre cursed one hopelessness stinks tribal bigotry,True Positive
watch employees clean guests rooms get feeling hopelessness sad thruth think hotel like would profitable even today,True Positive
think point id rather feel nothing constantly feel hopelessness lack self worth,True Negative
absentia slow melancholic metal favourite genre metal song encapsules feeling strugglinghopelessness isaac feels going horrors imagination extremely well,True Positive
hope amidst hopelessness james baldwins letter nephew william spivey black history month 365 aug 2022 medium via,True Positive
every dweeb complains marvel movies probably 1000x corny irl,False Negative
دانييل كورمييه في مقابلة اسلام,False Negative
longer live realize reality made pain sufferings emptiness madara uchiha naruto shippuden,True Positive
yes marvel definitely invented bad monologues didnt exist mcu thats definitely true,True Positive
week recommended several recent paperbacks nottobemissed probable impossibilities alan lightman carried tiya miles new yorkers craig taylor harlem shuffle colson whitehead book form emptiness ruth ozeki,True Negative
good picks,True Negative
id advice playing tbh ya theyre long games super worth youll feel extreme satisfaction upon finishing emptiness,True Negative
lets goooooooo,False Negative
requiem innocence left feeling certain type way think maybe feeling emptiness emotional stress damage,True Negative
first thor movie pretty underrated,True Negative
whats real pussy disease show pancreascompletely replaced w fat pancreas liver failure brain dissociation chronic emptiness triggers weak im annoying take lmao,True Positive
historical figures chief justice president william howard taft,False Negative
yes,False Negative
excoworkers got sentenced 15 years 15 im fucking angry unreal,True Positive
oh nooooo poor little guy,True Positive
well latsot around forever doesnt mean something else hasnt lurking even longer,True Positive
bad appears many people turned red one night angry reality evil really,True Positive
aye yooo guy need u one nyc af mids u cop sir lol,True Negative
dont slightest idea angry true god right yahuah elohiym tsevaoth enraged wthis wicked nation also whis people love idols serve host heaven amp congratulate identity abba help us,True Negative
im seriously tired democrat bashing msm,True Positive
dari lu pakar gade bini,False Negative
hmm feel familiar watts uprising 1965,True Negative
cry little puts knew coming guys fake outbursts hilarious 75 nation celebrating,True Positive
diana karau speaking says uvalde family community says place outside voices come create chaos words met clapping head nods angry outbursts watchdogs,True Positive
let good doctors twitter outbursts act cautionary tale huffing glue,True Negative
dumbass realizing anger violent outbursts longer moves,True Positive
know ive piece shit last however long im trying t_t hope forgiven past present future outbursts,True Positive
wake angry day fueled angry outbursts,True Positive
let come open dare likely well see outbursts anonymous violence arent coordinated organization,False Negative
dont know issues complaining officials normal outbursts 2009 2018 top thats twice long career anyway nice evening grow,True Negative
galatians 51921 sexual immorality moral impurity promiscuity idolatry sorcery hatreds strife jealousy outbursts anger selfish ambitions dissensions factions envy drunkenness carousing practice things inherit kingdom god,True Positive
moment awakening may marked outbursts laughter laughter someone lottery kind victory laughter one searching something long time suddenly finds pocket coat thich n hanh,True Negative
ric flairs wildest outbursts via 49ers game days wooo coming soon,True Positive
irritability part depression pisses ugh,True Positive
depression natural reaction serious loss depression individuals depressed often deny minimize problem signs amp symptoms vary dont always follow particular pattern include persistent sadness feelings hopelessness irritability,True Positive
symptoms dehydration include disorientation irritability sleepiness,False Negative
irritability dissociation selfimportance dellusions elevated humor violence turn dangerous uncontrollable freak nature harm ones like liked fair anger good,True Positive
work 4 career6 finance6 relationships5 health8 peace6 happiness5 irritability10,False Negative
ile irritability iko na almost everyone sa hiijaribu kitu ndogo tu uone hasira utaletewa,False Negative
feelings restlessness irritability urge constantly complain yeah nut shell right,True Positive
im naturally irritable person irritability levels go im either hungry sick im irritated fact im sick body feels place theres nothing stress also contributes bring sick,True Positive
extreme heat also affects emotions cause increased irritability aggression depression pay attention feelings try maintain healthy diet exercise indoors good sleep need call mental health hotline 18887934357 anytime,True Negative
high irritability,True Negative
signs amp symptoms shouldnt ignore feeling emptiness sadness reduced interest activities used enjoy lack energy fatigue irritability pain physical changes sleep disorder loss appetite,True Positive
eff minions hard pressed wall hard place frustration boiling never seen ppl trapped choosing idol feelings,True Positive
bully bullying question voicing frustration abt lack content,True Positive
love would okay made horrible attempt draw second pic probably wont see light day get perfect 6 months frustration,True Negative
okay birthday august 9th always take frustration politicians like said dont know way unless throw money,True Negative
im touch ranked first time today bring frustration,True Negative
got stuff deal im trying work frustration gym cant let fester,False Negative
let get internet give heart attack stroke barely contained anger frustration,True Positive
wall frustration got ta eat food,False Negative
klling zelinsky turning martyr ideal better leaving alive focal point ukr frustration war continues grind,True Negative
apologize frustration still experiencing supply issues national level time menu app limited menu containing items ordered sonic drivein across country supports order ahead sorry,True Positive
course bombardment saki air base crimea russians russians best attack civilians retaliation shows desperation frustration able finish ukraine,True Positive
dont know works thats political muscle 28 turns thousand fines interest legal fees plea deals means prison time political opposition smear job loss home savings retirement,True Positive
thats loss thats rent presumably get value exchange need net property taxes interest opportunity cost payment regular long term maintenance insurance depreciation appliances water sometimes utilities,True Positive
gradual loss interest trivial things depression better focus things people matter fortunately theyre,True Negative
worst probably wrong word 2nd biggest amp fastest developed world faster amp bigger even japans property market imploded years ago good 2st time buyers lets hope bought recent yrs get thru interest rate rises amp loss equity,True Positive
worst probably wrong word 2nd biggest amp fastest developed world faster amp bigger even japans property market imploded years ago good 2st time buyers lets hope bought recent yrs get thru interest rate rises amp loss equity,True Positive
takes 2 days watch movie loss interest everything j unbelievable,True Positive
pp symptoms anger anxiety mood swings fatigue loss interest appetite hopelessness guilt weight gainloss,True Positive
yes even japan time property bubble implosion around amp high drop value rising interest rates loss equity current owners especially purchased recent yrs may severe lets hope survive forced sales,True Positive
news alert sent imf subscribers loandepot brainchild industry veteran anthony hsieh tuesday afternoon reported 2238 million loss second quarter amid higher interest rates,True Negative
diagnose cause loss interestif cantfind anything else youd rather likely enjoy itas job dothen go life long never late get something dont want,True Negative
hes stay even washas said isnt stay listens kpop found interest sk group knows well yes compared didnt say theyre terrible didnt say anything reminded sk one respect kpop,True Positive
neoreichian clinician bird app uses therapeutic worthlessness ridiculous clients,True Positive
living bpd hard constantly ongoing feelings emptiness worthlessness even meds still feel way intense past days still feel useless lacking purpose music least given something work towards,True Positive
still get mad people see beauty within see beauty know others dont want train people think blackness worthlessness,True Positive
scenario 2 gets freddyd one knows play bhvr nerfs worthlessness becomes memetier pick people still play due voicelines forever low tier lists,True Positive
whole paper testament worthlessness post wank critical self reflection,True Negative
got overwhelming feeling worthlessness,True Negative
worthlessness thats sure consume dares stop jumping sake jumping becomes purpose socalled passion plus jumping fred tricks believe hes control situation amp calls shots,True Negative
ceasing eyes drew vision fading second passed within mortal state fell victim grave wounds gushed darkened ichor worthlessness sense doomed maneven would endure body,True Positive
abused children prone worthlessness doesnt permit pride envy wout coaching amp lust sex passion cunning jaded prostitute remind growing amid selfrighteous judgmental xtians bible belts shiny buckle,False Negative
8 time power didnt child meets deep archaic need push every advantage fight psychological survivalthe antidote unbearable feelings shame worthlessness must prepare,True Positive
jesus says blessed poor spirit kingdom heaven declaring enter gods kingdom must recognize utter worthlessness spiritual currency amp recognise spiritual poverty amp need god,True Positive
mean probably none theres also really levels guilt guilty guilty also probably cause whole different thing,True Positive
heres see hell cheerio therapy isnt enough need guilt trip children harass,True Positive
let go negative emotions guilt regret fear inner conflict medita via,True Positive
supposed petty guilt trip something never friends,True Positive
actually find super super unprofessional ive cancel therapy appointments extremely last minute covid etc therapist would never dream giving guilttrip like like especially youve time everything past,True Negative
feel fucking useless rn man things help im exact position things idk harboring lot guilt imscared bad terms feel really bad im stuck little things dont matter,True Positive
crooks never provide evidence guilt,False Negative
feel ungodly amount guilt people tik tok trick friends getting minion face paint,False Negative
hes crying search warrant found something proves guilt cry louder,True Positive
dont theres shame although feel little bit guilt guy cleans gutters older amp im old ladders,True Negative
hope catholic converts like us og catholics crippled unrelenting guilt rest lives,False Negative
statement po reflects part failures elections,True Positive
many women children us run lives protect children sps rcmp cared thought dead pressure blatant failures solidarity dawn,True Positive
see reason everyday failures let pro field take charge fgs haba dont forefront tasks every time,True Positive
cant say definitively fishing wrong also cant say arent either justice system numerous failures past always right,True Positive
munhu wese anenzara bro people needs stop replying soft soldiers 1st world countries zvemu zimbabwe inzara period funny soldiers nerve beat protesters suffering result regimes failures,True Positive
real reason sometimes projects fail venture opponents call upon failures whole,True Positive
lol show never ends get butchered blood draws expect people able accurately make failures sucking pfizer heads sand,True Negative
nara folks prosecuted far many people last 40 years far less serious failures maintain confidential information pra updated gop 2015 expected hrc potus 2017 teeth fra,True Positive
sd card failures absolutely suck 3 times shoot video intro field production class,True Positive
certainly argue effectiveness president failures suggesting made millions something nefarious pretty dumb see original tweet hilarious followed im dumb lol,True Negative
need evidence 7 major failures biden presidency,True Positive
causes irrational thoughts might wonder irrational thoughts create illusion reality thoughts stem selfblame poor selfesteem anxiety poor social communicative skills name,True Positive
thank fortesa selfblame constantlyor invalidated toxic people,False Negative
reminding selfblameshame trauma educational institutionssettings may never get rest life im literally fighting trauma responses daily enough okay fking okay,True Positive
على عكس السائد بس ال self blame العقلاني شئ صحى و محفز لتصحيح الاخطاء و الاحوال مفيش اسوء من ان نفسك تصعب عليك و تبقى رامي طوبتها لدرجة انك تكسل تلوم نفسك,False Negative
mag self blame kasi wala naman ibang sisihin,False Negative
avoid making sense pain soon finding relief quickly blaming someone anguish seeking revenge dont cave seek refuge self blame self pity playing role victim martyr,True Positive
without formal dxs hard break defense mechanisms especially self blame biggest fight forever trying break toxic circles,True Positive
ive noticed self blame fitting anywhere wasnt choice fit painful also rebel fitting life affirming im individual owned anyone family,True Negative
timeless transcendent poetry enlighten word word reconciliation selfblame amp judgment todays modern reality modern mystical get hearth,True Negative
ako lng ba ung nag susuffer breakdown every night sobrang hirap sabihin kahit kanino wala din akong balak mag kwento puro self blame kung ano ano pumapasok sa isip ko point na nadodown na ako di ko na alam gagawin sa sarili ko,True Positive
dont repress anger keeps u safe tells u danger environment,True Positive
easy target bullies actions scarred quite badly tend scar victims feeling many different things death first thought karma didnt deserve death shitty five years,True Negative
death might afford thought made smile afterlives reapers said haunted sent hell reapers survived hazards employment cursed insanity early death could small blessing,True Positive
always thought people making money death pariahs like trying feel sorry card despicable,True Positive
dont like politics well liked politics dont like assaults capital neither law thought party law order jan 6th thugs unleashed cause chaos death fox news joke,True Positive
fat ass eyelashes death sum u hoes u never thought,True Positive
finally watched listened podcast nailed exploiting grief villinize dr strange could wrong death wonderful female character thought movie slow times didnt fully hold attention,True Positive
im proud garland complained thought would indictments yesterday said wrong garland hes following law wherever may lead hear death threats coming ppl astonishing kevin mccarthy ashamed,True Positive
irs needs agents tbh lets see orwell socialist solzhenitsyns wife said gulag archipelago little folklore wrongly appraised bradbury mad tv becoming popular thought would death books rand,True Positive
yeah yall dont care much corruption diversity scares death trump white man gives warm fuzzies problem criminal fake rest us pay consequences actions thought believed law order,True Positive
always thought infecting everyone spike proteins course may straight death slow reduction life expectancy,True Positive
tw pet death graphic even still believe upon seeing fall cat tower sieze completely blue first thought wasnt surprising hes always weird mentally physically,True Positive
values crooked btch one friends committing suicide next bill still visit epstein island pal jeffrey gone,False Negative
committed suicide set fire,True Positive
replace everything aquamans right ayer cut suicide squad deal,True Positive
seu perfil foi visto por 6 pessoas nas últimas 2 horas,False Negative
stfu youre telling leave someone alone mocking someones threat suicide bout yall leave janina alone reap sow,True Positive
hey taking want pass along reminder silently suffering whatever reason please dont hesitate dial 988 us andor visit suicide amp crisis lifeline website matter,True Positive
im sorry wish could take pain away always know friend im always ever want talk vent im listening ear tbh feel exact way recently sexually assaulted feel like committing suicide,True Positive
tw suicide im pretty overweight shit ngl like wan na kms sometimes wasted life im looks useless worries page kkofi nobody donate tip havent much supporting yet,True Positive
think actual numbers like 900 yeah biggest mass suicide history think,False Negative
increased acceptance trans people san francisco also changed rate suicide,False Negative
still quite cheap considering russian army committing suicide thats priceless,True Positive
bruh mom offering graphic design services random old ladies facebook want 10x5 pixel photos edited photoshop going send early anxiety induced grave,True Positive
anxiety poop heading venue,False Negative
anxiety thats part asked,False Negative
anxiety attack mostly done back scheduled tweeting,True Positive
soon joined viper single recognizable feared aircraft naf low level evoke terror also ability loiter around target area prior attack caused additional anxiety,True Positive
always brain get rid anxiety nuke orbit taking almost every emotion leaving desolate wasteland burnt husks dysphoria confused crying behind,True Positive
thanks maybe anxiety idk start back work next week bunch new responsibilties year feeling super confident,True Negative
go streaks used smoke mostly sativa staying really active long stretch favoring indica anxiety reasons lately ive smoking without major preference mostly purchased hybrids,True Negative
told mom earlier anxiety attack immediately goes topic asks take work end month trip shes planning lol,True Negative
seconded anxiety grown past years expecting actually dissipate need dig deeper solutions would welcomed investigation,True Positive
alone friend im praying feelings depression anxiety subside meaningful friend come life soon,True Negative
eh one two believes lives control astrology really core way read patterns interest science human behavior see appeal nothing astrology says cure depression prayer,True Negative
know feel depression updated reached new level im denying depression probably isnt yet sometimes feel like cant get rid forever,True Positive
ur depression better fucking behave else ill beat bare fists,True Positive
depression,True Positive
pete davidson doesnt appear happy wonder dealing depression something goes woman woman relationship ends quick,True Positive
depression sit fuck partying saturday,True Positive
short control depression something overcome ones told fault control lied get money,True Positive
yet nobody wants talk people research paper suggesting people live proper almost always overcome depression meaning break bad habits build good ones live proper life youll overcome depression,True Positive
received shit someone asking ever diagnosed keep mouth shut id like see look face truth weve lied along depression,True Positive
offered simply live healthy pray belief god helped got depression heres thing,True Negative
told story depression offered advice anyone whos struggling dont want take meds dont luxury diagnosed,True Positive
im gone lie periods hell im ready birth control whatever come weight mood swings edges dont give fuck point,True Positive
ctrl really helps mood swings absolutely adore album,True Negative
video games increase immune system support health ways helping mood swings,False Negative
n mood swings,False Negative
rough day kinds moods,True Positive
im probably going get crap oh well bpd borderline personality disorder severe anxietydepression ptsd im meds usually manage sometimes mood swings get better cant always control,True Positive
video games also believed reduce mood swings reduce anxiety stress improve focus memory,False Negative
mood swings common women period stuff men take effence downgrade,True Positive
happy birthday bestie nd innocent person avi may birthday brings lot joy happiness thanks everything given nd also thank bearing mood swings njoy day sending love n hugs party,True Negative
walk park five minutes swings way elevate mood today mahal ko blessings gratitude,False Negative
mood swings worst fr,True Positive
dont know works thats political muscle 28 turns thousand fines interest legal fees plea deals means prison time political opposition smear job loss home savings retirement,True Positive
thats loss thats rent presumably get value exchange need net property taxes interest opportunity cost payment regular long term maintenance insurance depreciation appliances water sometimes utilities,True Positive
gradual loss interest trivial things depression better focus things people matter fortunately theyre,True Negative
worst probably wrong word 2nd biggest amp fastest developed world faster amp bigger even japans property market imploded years ago good 2st time buyers lets hope bought recent yrs get thru interest rate rises amp loss equity,True Positive
worst probably wrong word 2nd biggest amp fastest developed world faster amp bigger even japans property market imploded years ago good 2st time buyers lets hope bought recent yrs get thru interest rate rises amp loss equity,True Positive
takes 2 days watch movie loss interest everything j unbelievable,True Positive
pp symptoms anger anxiety mood swings fatigue loss interest appetite hopelessness guilt weight gainloss,True Positive
yes even japan time property bubble implosion around amp high drop value rising interest rates loss equity current owners especially purchased recent yrs may severe lets hope survive forced sales,True Positive
news alert sent imf subscribers loandepot brainchild industry veteran anthony hsieh tuesday afternoon reported 2238 million loss second quarter amid higher interest rates,True Negative
diagnose cause loss interestif cantfind anything else youd rather likely enjoy itas job dothen go life long never late get something dont want,True Negative
hes stay even washas said isnt stay listens kpop found interest sk group knows well yes compared didnt say theyre terrible didnt say anything reminded sk one respect kpop,True Positive
miwaﾁｬﾝ おはよ stigma うんうん 胸がぎゅーんってなる 朝から嬉しい気持ちありがと わたしはぐぅさんの本物の天使かと思った この伝説のeuphoriaが好き,False Negative
peak gender euphoria photo never achieve greatness,False Negative
