Text,Category
dan delusion believes still respected journalist neither respected journalist soros brought hell purgatory hes parrot,True Positive
unpopular correct opinion bpd real one person figure somehow trust bullshit copout delusion,True Negative
agency x reunion alex outlaw became sandi taskmaster given amnesia apparently unknowingly married years deadpool joining reunion still hard copies agent x series,True Negative
rueda por ahí en su silla de ruedas,False Negative
sometimes start wonder lie real could fine cause im fine amnesia 5 seconds summer,True Negative
many challenging scary aspects self employment also sometimes shift appointment thirty minutes catch new song drops thats nice,True Negative
se golpeó en la cabeza será amnesia temporal jajaja un chiste los del rechazo se hacen llamar patriotas,False Negative
hardcore amnesia needed,False Negative
apparently marco 2016 undergone persisting brain seizure called craven ambition amnesia means marco 2016 hear 2022 rino trumpista suckup,True Negative
amanhã vou pegar uma amnésia haze ansiosa pra ficar bem chapada,False Negative
optimism amnesia whatever want call definitely obfuscates capacity see little actually changed,True Positive
cuanto cinismo cuanta doble moral diria el ñaño contagiosa ha sido la amnesia,False Negative
bitterselective amnesia real,True Negative
honestly nothing tweet know ok lmao youre damn good writer feel every words feelings love insicurety taehyung thing right person wrong time experienced time yeah sadness everything,True Negative
even expartner exhibit abusive behaviors relationship theres possibility feelings anger sadness could lead abusive online technology amp social media create spaces abuse take place,True Positive
waske wane misplaced feelings sadness ngoku uelu hayi bawo,True Positive
realized uncool discuss pain feel walking away something wasnt meant wed rather talk giving bad bitch vibes actually bestie need confront feelings disappointment acknowledge sadness,True Positive
hate seeing videos women treating men like garbage pisses cuz folks believe women 90 time like bruh yall forget theres 2 sides everything guys get bullied feeling feelings sadness wonder suicide rates high men,True Positive
really sadness feeling kinda im sad also happy dont exactly know know replace feelings feelings im sure sure dont feel im replacing,True Negative
survey sixth eighth eleventh graders oregon 2020 found least half reported feelings sadness hopelessness two weeks time explores causes talks folks trying help,True Positive
heart beat fast anger confessing whats bothering heart beat fast sadness cried feelings heart beat slow tired rollercoaster emotions went,True Positive
close person one pole depends entirely person generally speaking feelings sadness joy subjective replace like harmonics,True Negative
ways definitely easier ive struggled feelings guilt sadness driving home late night feelings hurt,True Positive
perinatal depression mood disorder affect women amp pregnancy mothers experience feelings extreme sadness anxiety amp exhaustion may make difficult complete daily care activities others,True Positive
first purpose hope make hopelessness bearable,True Negative
interesting sensation hopelessness post,True Negative
ive following last 2 years rabbit hole deep lead deep feeling hopelessness go rabbit hole things close matter outside system live,True Positive
bandits killing people isnt hopelessness thats making long youths remain hopeless frustrated never peace,True Positive
trump hell lot smarter give team angels therefore greater good people ceaseanddesist sending anxiety doubt hopelessness humanity stop,True Positive
lots people given nigeria long ago many dont even believe election would make difference lives people rallying behind obi means see last chance theyre giving nigeria cant u feel hopelessness land,True Negative
one agonizing days ive ever experienced everytime thought reached worst point fucked harder never forget watching shook could anyone feel anything fear anger hopelessness act,True Positive
hard stood watching people running building covered ashes debris scared petrified even moment felt though back front lines watching men run lives enemies follow hopelessness fear,True Positive
health canada would force take experimental injections called covid vaccines guinea pig lose job able support family would drink take drugs deal hopelessness,True Positive
e sure go sign una dey beyond rejection players cant even reject man u currently man u mean hopelessness,True Positive
1st volume poetry available free amazing followers could check amp rt would fantastic boost 4 defiant hopelessness dark side aspergers autism reflected poetry,True Negative
emptiness,False Negative
jolipiar punto de drogas ese es su gran trabajo,False Negative
uma galera pegou pra mandar pras mulheres,False Negative
وإن غفرت جرمه أعاد ما كان جرم,False Negative
entiende que la cosa van cambiar compadre tu nacite morira siendo el mimo singa tu madre,False Negative
هلا بالحب خالد مشتاق والله,False Negative
подписываюсь под каждым словом,False Negative
rapero trascendental unico original como yo habito otro ni lo habrá entiende carnal,True Negative
ارحب,False Negative
وعليكم السلام ورحمة الله وبركاته,False Negative
made,False Negative
yea yeabrave informant coward never reveal name nothing steele dossier russian hoax might want think different way trump engineered nothing produced mob angry people,True Positive
killorglin great spot dont know history puck fairness cherry picker today torture time change lads,True Negative
magas angry country,True Positive
delam mikhad behet payam bedam nmishe,False Negative
okay angry never ok cruel,True Positive
course gay people sense community allowed display bit pride shamed marginalised people get angry pride flags bit weird imo care,True Positive
ill join,True Positive
gcs naturally refer debunked science understand science dont even like unless weaponise agains queerses,True Negative
feel like pulled deaging thing babs instead fans would angry one would jump onto ship seems people forget since retconned long ago fine thats bad ship,True Positive
im angry sadden screwed economy crooked shyster im middle class person making 400k per year taxed plenty high inflation,True Positive
word hard disagree im happy recent commits well see plays fall cause genuinely believe gets top 10 class 8 win season,True Negative
another dive another rising junior matthew murrell 64 sg ole miss twoway potential shooting upside next level couple big scoring outbursts including 25 point outing kentucky,False Negative
riot police riot escalation force deter outbursts,True Positive
definitely problem public outbursts,False Negative
liberals perfectly happy strongmen like macronor better said weak men tyrannic outbursts like trudeau ardern happy grey tyrannies like biden regime position lecture anyone,True Negative
really maybe outbursts violence civil war,True Positive
republicans use word class mean wealth thats mean wealth richer classier even youre public buffoon known violent outbursts childish behavior like donald trump,True Positive
kind aggressiveness violence constantly threaten erupt society enjoyment pressure enjoy combined pervasive images enjoyment bombard contemporary subjects lead us outbursts one concludes summer sam,True Negative
sick outbursts work following mix meds combination financial stress week without meds crippling shame speaking toabout people way kicking bahookie however light already visible always gets better,True Negative
daniels credibility bad psychotic outbursts nothing says even matters anymore lol,True Positive
theres sumtin want folks understand chimaroke nnamanis recent outbursts baba looked around saw everyone becoming enugu threatens ambition return senate lackey peter mbahs guber ambition wike kess osimhen phyna,True Negative
yes little rescue boy weve 11 months hes best although likes keep toes occasional behaviour outbursts,True Negative
therapist told take next two days bask peace allow escape book feel creative flow without guilt part irritability coming place knows wont time soon,True Negative
diagnosed graves disease last time remember symptoms weight loss despite increased appetite rapid irregular heartbeat nervousness irritability trouble sleeping fatigue shaky hands muscle weakness sweating trouble tolerating heat,True Positive
investigation found 26 35 cases langya henipavirus infection shandong henan provinces developed clinical symptoms fever irritability cough anorexia myalgia nausea headache vomiting,True Negative
tested positive yesterday think energy added irritability today,True Negative
irritability causes 7 coping strategies,False Negative
day 9 covid test still positive new symptom irritability son schizophrenic informs good chance im coming back zombie serious,True Negative
ah yes really glad medical provider failed warn much new extended release meds could fuck irritability whole bunch stuff,True Positive
decided hang gallows must hang willfulness jealousy doubt suspicion irritability temper hateful machismo vices killed come back remember accept,True Positive
seems lamictal save irritability arrives people interrupt toastmasters,False Negative
irritability getting angry easily signs nervous breakdown makes sense everyone earth simultaneously nervous breakdown handling better others one missing order fries away public freakout,True Positive
slip ups realize im temporary emotional state ie anxiety irritability etc idk im writing wanted put universe case anyone else experiencing,False Negative
hey daniella would send overdue bills collections several reminders pay said bill go unanswered understand frustration comes receiving calls collections concerns please dm us take look tl,True Positive
mets fans lot pent frustration think know,False Negative
frustration frustration frustration سب مجھے مشورہ دیں کیونکہ میں ابھی ریٹائر نہیں ہونا چاہتا لیکن آفس والوں کا بہت دباؤ ہے میں نے کچھ اپنے حامیوں کو منا لیا ہے لیکن کچھ اور لوگوں کی مدد چاہیئے لیکن وہ دوست چاہتا ہے کہ میں ایک قابل مینجر کو نکلوا کر اس کو مینجر بنوا دوں,True Positive
,False Negative
wereautomobile owners like empathize pain frustration come dealing auto accident thats,True Positive
une ordure ce mec éden fait une bonne prep ne montre jamais sa frustration et en récompense nada foutage de gueule ce club ne mérite pas éden,False Negative
,False Negative
well faint blush ahem well isnt necessary write angry letters saber claus time frustration meant vented,True Positive
tight range 2230024200 bounces go bit lower stalls dumps go higherkind chop turns traders plans frustrationnobody cooms,True Positive
,False Negative
code fragmentation technique save packaging intralogistics professionals time money frustration click find,False Negative
interest pitch get internal injuries dont know empire isnt ےنون loss كود خصم best part,True Negative
trudeau still pm long since hes shown face us think ive seen hes announcing millions dollar giveaway special interest groups liberals going lose next election landslide itll make harpers loss pale,True Negative
mr giulianis role effort reverse mr trumps 2020 election loss georgia interest fulton county prosecutors number reasons train bus uber giuliani told come georgia,False Negative
things clients dont care loss markets impact inflation interest rates wage growth unemployment rate things clients actually care maintaining lifestyle protecting legacy worry items,False Negative
ashiwaju awon wereeeee think scared lot must continue destroy country selfish interest remember youth nothing loss,True Positive
right high interest savings account rate 140 month separate account months worth savings emergencies emergency fund designed protect common worstcase financial scenarios job loss,True Negative
public pension funds recorded worst annual performance since 2009 losing median 79 june 30th according data wilshire trust universe comparison service loss mainly occurred april june high inflation rising interest rates,True Positive
coursed americas interest let russia totally collapse suddenly security nuclear weapons paramount want russian loose right kind loss,True Negative
yes things tough ampmore needs done whos going pay cant afford bla bla bla hw 37b failed track amp trace furlough fraud ppe dodgy contracts wastage rishi loss bank interest money sure afford,True Positive
3 loss interest normal daily activities emotional withdrawal others loss energy motivation inability use understand language may include difficulty naming objects expressing words understanding meanings words hesitation speaking,True Negative
maybe im imagining despite poker face looks tired also fast loss interest plot would great cutie doesnt ended villain overall kengan fans favs murdered bunch people,True Negative
100 hope hes good start album singing worthlessness like songbird crazy lets reel back little get help man,True Positive
crippling worthlessness mediocrity complex take changing major every semester,True Positive
sees stark demonstration worthlessness depravity huge swaths modern academia hire women frauds,True Negative
roads eventually lead back trumps incompetence worthlessness maybe trump fulfilled promise lock appointed fbi head wouldnt instead apply law,False Negative
subject baseless persecutory fbi raid would simply release copy warrant show worthlessness,True Positive
excellent like many many scotts issues worthlessness,True Negative
chortling quietly reflect worthlessness human instrumentality,False Negative
ugm_fess hi anyone reading recomendation could article advice books etc cope worthlessness low self worth currently feeling worthless spend 3 hours crying thank much hope u good day,True Negative
despicable bureaucrats proven complete worthlessness unconstitutional government involvement science,True Negative
você ai,False Negative
hard write compelling resume youre phd experience first big challenge overcoming feelings worthlessness fear youll never happy outside academia thinking degree waste,True Positive
yes djt outspoken guilt proves,True Negative
well pov entire reason would want willingly testify refusal would seen automatic submission guilt thats youre getting anyhow state cant force testify incriminate,True Negative
tell said trump innocent never mind courts investigations dont put burden accused prove innocence rather accuser prove guilt thats works justice system design believing youre murderer make guilty,False Negative
fr cause wont guilt trip feelings get hurt,False Negative
said anything guilt statement evil ancestors certainly werebut im disowning accept acknowledge try better,True Positive
must like subject bringing feeling guilt since youre planning leaving armenia aswell,True Positive
taking fifth always appropriate response regardless guilt innocence generally shouldnt newsworthy,True Negative
sense guilt comment,False Negative
want say personal timeline nancy x steve gt nancy confusedgtnancy x steve againgtnancys survival guilt eating alivegtshe believes steve doesnt care since steves copying mechanism distractionescapismgtnancy stops loving stevegthence jancy,True Negative
mentality trump hes law fools enabling baby dem youd signing different tune guilt guilt cant discriminate,True Positive
dont think guilt think empathy,False Negative
know sarcastic seriousness considered putting name forward would great would understand wouldnt though since panel us hangerons political parasites beens failures,True Negative
proof facts evidence point one inevitable conclusion youve given wow things pretty humans prone pareidolia exist failures comprehension instead discovering plug god real evidence,True Negative
poor dementia riddled joeno one wants come see failures,True Positive
service meaning ottawa ashamed many failures starting lrt tax breaks porsche oseg rich corporation handout etc city tripled debt watson embarrassment,True Positive
failures,False Negative
yet failed every attempt since 2015 announced run pathetic since criminal per add list failures rallied would otherwise looked way,True Positive
emo failures rt im crying,True Positive
wonder one paid invaders came english channel paid hunting trip rape girls amp women ous land become worlds scum enter blessing politicians supposed protect abject failures,True Positive
entirely untrue comrade pussygrabber always symptom americas problems failures base root problem flushing bigoted cruel garbage back caves recommended,True Positive
like efforts get ppl watch skating complete failures everyone except yuzu hes incredibly easy love ways many top skaters top scores lol,True Negative
administrations failures disregard lives national guard border patrol children humans general incompetence purpose person morality decency would continue allow,True Positive
self blame low self esteem common todays descriptors redacted existence taken decades work therapy overcome constant guilting thats baked system amp social constructs highlighted insidious common,True Positive
alright uh well wasnt blaming im saying three events caused cycle self blame think youve somehow made things happen youre awful problem solved reality dont blame love,True Positive
way mgs2 presents purely otacons pov means gets shown lens selfblame isnt bad imo unfortunately lot people seem misplace critical thinking skills regards mgs2,True Positive
prayer submission begging things prayer invoking higher order removing belief self assigning something better many ways clearing mind self blame self reliance,True Negative
jade constantly threaten going therapy im victim disease terminal insufferable patients self blame ward,True Positive
hi guys feel mentally ill lot self blame fear alone im getting sick stress think might quit twitter last words loved guys,True Positive
fall short accept forgive thats natural order things fall short time luckily sometimes take time learn never amplify loses weakness self pity much self blame accept forgive,True Negative
pero karon nga dako nako akong hilakan kay mga problema disappointment sa kaugalingon self blame self regrets kanang maghilak tungods kadaghan sa imong problema nga wala ka kabalo ug asa gikan unsay hinungdan youre dealing anxiety depression overthinking,True Positive
full self blame self regretsss,True Negative
heal release transmute selfblame judgement selfcompassion may reawaken within get book,False Negative
never ending self blame,False Negative
weve strange sudden death epidemic wake universal experimental injection roll amp regimes thought inject people cocktail drugs otherwise would give milimetre ones culture war enemies amp wouldnt would,True Positive
13 miles walking mile running vo2max gone despite step count dwindling due stupid work eating life intercostal yanked healed quicker thought would thats grist premature death avoidance mill,True Positive
unfortunately dates birth death cemetery read thought born around 1560s certain,True Positive
thought tay contis jacket said til death us fart totally flatulence gimmick chris jericho man 1000 gimmicks amp none interesting since 2000 mox killed jericho mic week goddamn superstar,True Positive
thought starmer missed trick today questions lebedevitaly scandal refusing confidence vote 200000 covid deaths johnson crowing proud premiership wasted chance pin johnson,True Negative
yes bandera placed special section camp survived rest either gassed arrival worked death didnt want kill bandera thought unhinged much loose cannon walk around freely,True Negative
social commentary kanye favorite artist saw recent piece thought artistic strong risk sounding like fanboy subject matter death done artistically public figure status muddies true artist status media cmon,True Negative
trouble head money richard death row complaining routine food thought day marrying richard would appear cover rolling stones,True Positive
would much desk facing female head least 2000 years old thought souvenir 19th century discovered glass case clearout death man ramsgate kent great person talk,True Negative
dont get say goes supernova every 10000 years thought supernova 1x death star,True Positive
reek judas took brush clean teeth thought mouth kiss life kiss death,True Negative
also want talk grishams ability bunt bunt base hit bunt two strikes sac bunt lay safety squeeze lay suicide squeeze best want talk value,True Negative
le suicide nest pas sûr,True Positive
norwegians suicide watch,True Positive
а ти гарячий безсоромник,False Negative
munhu anga achichema depression suicide hype racks show haaa zimbos ma1,True Positive
im glad agree help japan share notable practices ritual suicide avoid capture infamous tactic cutting unaware opponent one strike would cool see predator take cues visually oni,True Negative
tell think good conversion therapy hate crimes high suicide rates employment discrimination vulnerable minority constantly used political tool,True Positive
death rate hasnt changed since restrictions lifted survival rate went 95 999 stopped counting people died causes c19 time death suicide rates gone since restrictions lifted,True Positive
murdered one breaks collar bones suicide without falling high building,True Positive
children bombs palestinian terrorist groups use children suicide bombings minors recruited attack israelis military civilian deliberate involvement children armed conflict condemned human rights orgs,True Positive
988 easytoremember numberits direct connection compassionate care support anyone experiencing thoughts suicide mental health substance use crisis kind emotional distress,True Negative
anxiety,False Negative
much driving anxiety exact reason,True Negative
killing young generation teenage boy rescued police,True Negative
dont wan na uwu im hardworking guys feel bad sort way genuinely feel much anxiety surrounding,True Positive
sounds like separation anxiety,False Negative
tell someone really like,True Negative
folks like space gives hope long term struggle longterm yay anxiety disorder surrounded people want change world better definitely helps,True Negative
driving anxiety works hard road trip playlist works harder,True Positive
avoid confusion unnecessary anxiety let iebc announce presidential poll results everyone else getting wrong ntv ruto confirmed kirinyaga didmus barasa itumbi susan natembeya hnib,True Positive
hes sharpest pencil case,False Negative
first purpose hope make hopelessness bearable,True Negative
bit speedy really helps portion physical symptoms depression like mine tell within day miss dose,True Negative
ive noticed many people saying similar things seemingly listing symptoms depression saying theyre mentally ill dont depression still stigma thing afraid admit think could feeling,True Positive
ile ya presidential drive deepest end depression someone check nelson doesnt believe political betrayal voters subjected nelson sick someone save,True Positive
killing young generation teenage boy rescued police,True Negative
smashed everyones head tight supply gold caused great depression us want run debt ponzi got get everyone thinking little money problem,True Negative
underrated depression food austin cheddar cheese crackers im sure orange dye nutritional value hit spot foods sound bad,True Positive
kind looks like depression,True Negative
munhu anga achichema depression suicide hype racks show haaa zimbos ma1,True Positive
quil est en fond un moteur pas fiable les ssv les retour dhuile dans ladmission toute la gestion par dépression sans parler de la mauvaise lubrification sous les 4000 tours en fond un moteur peu voir pas fiable,False Negative
touchy subject sum blame upbringing putting fight especially depressionyou make tik toks cant shit naw,True Positive
tell coworkers crippling depression august month bsf worst want crawl hole sleep month dont motivation work cause makes feel physically ill feel like im gaslighting,True Positive
oh god mood swings horrific,True Positive
video games also believed reduce mood swings reduce anxiety stress improve focus memory,False Negative
hospital bill aside would probably point bet go sleep wake 1000 dollars richer,False Negative
mood swings ruin everything literally,True Positive
praise sams soul dealing mood swings annoying,True Positive
symptom prepared hot flushes never came others came vengeance mood swings anxiety memory loss confidence floor aching joints etc took 46 months piece jigsaw together get treatment,True Negative
unbelievably many worries everything nothing everyday social battery mood swings taking everything heart feeling guilty alone endless stress cravings lack appetite given headsup mentalt hardship pregnancy,True Positive
check new single mood swings distributed live itunes go get,True Negative
barely deal w mood swings ik ppl hatingggg,True Negative
mood swings massive happy sad within second,True Negative
mood swings,False Negative
interest pitch get internal injuries dont know empire isnt ےنون loss كود خصم best part,True Negative
trudeau still pm long since hes shown face us think ive seen hes announcing millions dollar giveaway special interest groups liberals going lose next election landslide itll make harpers loss pale,True Negative
mr giulianis role effort reverse mr trumps 2020 election loss georgia interest fulton county prosecutors number reasons train bus uber giuliani told come georgia,False Negative
things clients dont care loss markets impact inflation interest rates wage growth unemployment rate things clients actually care maintaining lifestyle protecting legacy worry items,False Negative
