Text,Category
trouble head money richard death row complaining routine food thought day marrying richard would appear cover rolling stones,True Positive
would much desk facing female head least 2000 years old thought souvenir 19th century discovered glass case clearout death man ramsgate kent great person talk,True Negative
dont get say goes supernova every 10000 years thought supernova 1x death star,True Positive
reek judas took brush clean teeth thought mouth kiss life kiss death,True Negative
also want talk grishams ability bunt bunt base hit bunt two strikes sac bunt lay safety squeeze lay suicide squeeze best want talk value,True Negative
le suicide nest pas sûr,True Positive
norwegians suicide watch,True Positive
а ти гарячий безсоромник,False Negative
munhu anga achichema depression suicide hype racks show haaa zimbos ma1,True Positive
im glad agree help japan share notable practices ritual suicide avoid capture infamous tactic cutting unaware opponent one strike would cool see predator take cues visually oni,True Negative
tell think good conversion therapy hate crimes high suicide rates employment discrimination vulnerable minority constantly used political tool,True Positive
death rate hasnt changed since restrictions lifted survival rate went 95 999 stopped counting people died causes c19 time death suicide rates gone since restrictions lifted,True Positive
murdered one breaks collar bones suicide without falling high building,True Positive
children bombs palestinian terrorist groups use children suicide bombings minors recruited attack israelis military civilian deliberate involvement children armed conflict condemned human rights orgs,True Positive
988 easytoremember numberits direct connection compassionate care support anyone experiencing thoughts suicide mental health substance use crisis kind emotional distress,True Negative
anxiety,False Negative
much driving anxiety exact reason,True Negative
killing young generation teenage boy rescued police,True Negative
dont wan na uwu im hardworking guys feel bad sort way genuinely feel much anxiety surrounding,True Positive
sounds like separation anxiety,False Negative
tell someone really like,True Negative
folks like space gives hope long term struggle longterm yay anxiety disorder surrounded people want change world better definitely helps,True Negative
driving anxiety works hard road trip playlist works harder,True Positive
avoid confusion unnecessary anxiety let iebc announce presidential poll results everyone else getting wrong ntv ruto confirmed kirinyaga didmus barasa itumbi susan natembeya hnib,True Positive
hes sharpest pencil case,False Negative
first purpose hope make hopelessness bearable,True Negative
bit speedy really helps portion physical symptoms depression like mine tell within day miss dose,True Negative
ive noticed many people saying similar things seemingly listing symptoms depression saying theyre mentally ill dont depression still stigma thing afraid admit think could feeling,True Positive
ile ya presidential drive deepest end depression someone check nelson doesnt believe political betrayal voters subjected nelson sick someone save,True Positive
killing young generation teenage boy rescued police,True Negative
smashed everyones head tight supply gold caused great depression us want run debt ponzi got get everyone thinking little money problem,True Negative
underrated depression food austin cheddar cheese crackers im sure orange dye nutritional value hit spot foods sound bad,True Positive
kind looks like depression,True Negative
munhu anga achichema depression suicide hype racks show haaa zimbos ma1,True Positive
quil est en fond un moteur pas fiable les ssv les retour dhuile dans ladmission toute la gestion par dépression sans parler de la mauvaise lubrification sous les 4000 tours en fond un moteur peu voir pas fiable,False Negative
touchy subject sum blame upbringing putting fight especially depressionyou make tik toks cant shit naw,True Positive
tell coworkers crippling depression august month bsf worst want crawl hole sleep month dont motivation work cause makes feel physically ill feel like im gaslighting,True Positive
oh god mood swings horrific,True Positive
video games also believed reduce mood swings reduce anxiety stress improve focus memory,False Negative
hospital bill aside would probably point bet go sleep wake 1000 dollars richer,False Negative
mood swings ruin everything literally,True Positive
praise sams soul dealing mood swings annoying,True Positive
symptom prepared hot flushes never came others came vengeance mood swings anxiety memory loss confidence floor aching joints etc took 46 months piece jigsaw together get treatment,True Negative
unbelievably many worries everything nothing everyday social battery mood swings taking everything heart feeling guilty alone endless stress cravings lack appetite given headsup mentalt hardship pregnancy,True Positive
check new single mood swings distributed live itunes go get,True Negative
barely deal w mood swings ik ppl hatingggg,True Negative
mood swings massive happy sad within second,True Negative
mood swings,False Negative
interest pitch get internal injuries dont know empire isnt ےنون loss كود خصم best part,True Negative
trudeau still pm long since hes shown face us think ive seen hes announcing millions dollar giveaway special interest groups liberals going lose next election landslide itll make harpers loss pale,True Negative
mr giulianis role effort reverse mr trumps 2020 election loss georgia interest fulton county prosecutors number reasons train bus uber giuliani told come georgia,False Negative
things clients dont care loss markets impact inflation interest rates wage growth unemployment rate things clients actually care maintaining lifestyle protecting legacy worry items,False Negative
ashiwaju awon wereeeee think scared lot must continue destroy country selfish interest remember youth nothing loss,True Positive
right high interest savings account rate 140 month separate account months worth savings emergencies emergency fund designed protect common worstcase financial scenarios job loss,True Negative
public pension funds recorded worst annual performance since 2009 losing median 79 june 30th according data wilshire trust universe comparison service loss mainly occurred april june high inflation rising interest rates,True Positive
coursed americas interest let russia totally collapse suddenly security nuclear weapons paramount want russian loose right kind loss,True Negative
yes things tough ampmore needs done whos going pay cant afford bla bla bla hw 37b failed track amp trace furlough fraud ppe dodgy contracts wastage rishi loss bank interest money sure afford,True Positive
3 loss interest normal daily activities emotional withdrawal others loss energy motivation inability use understand language may include difficulty naming objects expressing words understanding meanings words hesitation speaking,True Negative
maybe im imagining despite poker face looks tired also fast loss interest plot would great cutie doesnt ended villain overall kengan fans favs murdered bunch people,True Negative
drugs show less cool factor shows use euphoria drugs serve narrative purpose never taken lightly explain bad yet good feel people get addicted,True Negative
lucinda takes inspo euphorias maddy perez,False Negative
euphoria publication medium,False Negative
tell man euphoria season 2 done shooting,False Negative
そうなの作ったらお迎え行くね,False Negative
saltine cracker ass showmance boring barely chemistry cringe ass conversations thats giving degrassi euphoria lets real,True Positive
compensation may reduced due survival given watched edit 4 times row may sued instead putting catatonic state,True Positive
mi hermana acaba de contar una cosa que luego como para que digan que euphoria es todo falso e irreal,False Negative
giving euphoria vibes,False Negative
gender euphoria hits good greasy hair sleeveless tshirt silent evening,True Negative
mais oui incroyable,False Negative
thinking suicide attempt scared,True Positive
personal memoir sixtyninth street suicide wisdom learn failed suicide attempt posted calumet editions amp,True Positive
personal memoir sixtyninth street suicide wisdom learn failed suicide attempt posted calumet editions,True Positive
personally think allow enough charity good faith even people dislike also watch quite frequently didnt see make fun suicide attempt attention seeking behavior twitter afterwards,True Negative
doe made fun suicide attempt months since first time charitable,True Negative
want greater understand movement suicidal thoughts suicide attempt make movement absolute travesty article,True Positive
annoying bitch wish suicide attempt worked,True Positive
cheating bad wife werent lisa narrative puts blame tatsu replaced wasnt hiatus due poor health amp failed suicide attempt anime staff cant stop production wait single voice actor move pls,True Positive
tw suicide attempt year garbage id struggling mental health suddenly losing job home january tried end 5 weeks ago stabbing wrist close call remember laying trauma center hours,True Positive
yeah though dont know itd suicide attempt theres definitely still masks doctors ireland,False Negative
mehn survive suicide attempt,True Positive
disrespect arrogance talkativenessad nauseam,True Positive
someone talked women talk much lwaki mulina empisa embi even simple talkativeness,True Negative
hyunseul choosing act cowardly unfairly big deal prayer two take care affected talkativeness mine digging grave burning ghost ruledeco27,True Positive
affected talkativeness mine digging grave burning,False Negative
give back kelulis unforgettable character experience watching screen love clumsiness talkativeness thoughtfulness kindness dedication work im really happy met point life,True Negative
probably jeff bcs hes fav think well hv right amount talkativeness quietness laugh easily think laugh questionable jokes,True Negative
leader line choosing act cowardly unfairly big deal prayer two take care affected talkativeness mine digging grave burning ghost ruledeco27,True Positive
bind cast spirits talkativeness nervousness tension fear name jesus,True Positive
way trying diagnose via internet considered may autistic observing afar things like racing thoughts insomnia depression adhd burnout preferring abroad difference self others explainable 12,True Positive
many thoughts racing thru mind guess one really stands pity,True Negative
youre beautiful gary sunshine look wonderful eyes tend lose thoughts eyes got heart falling look eyes heart starts racing see falling,True Negative
guess especially racing thought trick lens honest,True Negative
thoughts racing sometimes,False Negative
thought heart racing pulse 72 bpm thats racing,False Negative
dont know answer jockeys retirement fund horses fund take retirement major league sport like horse racing fund take care major players never thought reading thread,True Negative
thought looks like beasts running qualify pairs within class little softer maybe find soon,True Positive
100 thoughts exactly granted knockout rounds start itll ol bloodbath moving right direction love,True Negative
initial thought races diluted much currently inside class within class know exactly minim 56 horses every race even enter dont think open qualifying way thoughtopinion,True Negative
wouldnt call hill retired means dudes racing last years others confuse makes feel like wsx lot like paris sx last year mad chose race wsx year bit different thought would,True Positive
talk alcohol abuse,True Positive
went sandyford 24yearold woman long history depression anxiety selfharm alcohol abuse suicidal ideation,True Positive
right definition alcohol abuse,True Positive
alcohol abuse,True Positive
terrible case alcohol abuse,True Positive
yes alcohol abuse,False Negative
alcohol abuse grand scale,True Negative
thats alcohol abuse,True Positive
people troubles may drug alcohol abuse bringing hendford hill going stop problems theyre going come,True Positive
keep annie youre pretty young thingyou cant even imagine drug amp alcohol abuse make look like 20 yrs trust,True Negative
ways manifests place names real alaskan bullshit attitudes alcohol abuse etc,True Positive
sleep issues commonly associated wanxiety bipolar disorder see teens wcritical mental health issues amp accidents suicidalitythings parents really worry aboutamp getting enough sleep addresses issues via,True Positive
usually people get mixed bipolar disorder bpd dying,True Positive
basics guess name winnie age 26 role persecutor systemdom bed zodiac leo likes wine mixology herbalism tarot oil pastels charcoal mental health alter system well bipolar disorder thats fun,True Negative
hey thank follow,False Negative
wild take medication bipolar disorder causes gum bleeding get quarterly irrigation insurance cost 300 today healthcare right teeth,True Negative
youth bipolar disorder high risk eating disorders investigators studied close 200 youth bipolar disorder found 25 lifetime eating disorder,True Positive
생활픽 108 조울 치료 108 treatment bipolar disorder 237 196,False Negative
bipolar disorder type 1 journal beautiful journal workbook track moods bipolar symptoms energy therapy coping eul2fmh,True Negative
since lost accounts due formatting phone pc made new vent account yeah follow wan na see ramble bipolar disorder depression,True Positive
alternatives using get work school,False Negative
hypersexuality trauma response people others side effect disorder bpd bipolar disorder,True Positive
jordan seems memory thought disorder,False Negative
shes displaying line thinking call thinking accusations admissions bent thought disorder,True Positive
know folks thought disorder going new dsm axis 2 dx soon,True Positive
nihilism considered like thought disorder youre refusing using pattern seeking part brain make fiction historical progress psychology favour thinking,False Negative
blocked spiderman god war getting xbox whaaatt youre swiming delusion guy,True Positive
babe boner ass oh im lost sea alone flotsam water ice cold mind succumbing delusions,True Positive
need receivers like cole beasley fewer like diontae johnson,False Negative
だから本当の自分なんて嫌いなんだ でも誰かに見せないとやってられない だからフレネミーみたいになるんだろう,False Negative
brain warp delusion,False Negative
new york catholic convert delusion,True Negative
pray u forever get played shitted cause thats u deserve ur delusions,False Negative
contrary believe delusions help function stay relatively sane many incredibly fragile afraid pursuing truth,True Positive
story andrews delusions,False Negative
dan delusion believes still respected journalist neither respected journalist soros brought hell purgatory hes parrot,True Positive
unpopular correct opinion bpd real one person figure somehow trust bullshit copout delusion,True Negative
agency x reunion alex outlaw became sandi taskmaster given amnesia apparently unknowingly married years deadpool joining reunion still hard copies agent x series,True Negative
rueda por ahí en su silla de ruedas,False Negative
sometimes start wonder lie real could fine cause im fine amnesia 5 seconds summer,True Negative
many challenging scary aspects self employment also sometimes shift appointment thirty minutes catch new song drops thats nice,True Negative
se golpeó en la cabeza será amnesia temporal jajaja un chiste los del rechazo se hacen llamar patriotas,False Negative
hardcore amnesia needed,False Negative
apparently marco 2016 undergone persisting brain seizure called craven ambition amnesia means marco 2016 hear 2022 rino trumpista suckup,True Negative
amanhã vou pegar uma amnésia haze ansiosa pra ficar bem chapada,False Negative
optimism amnesia whatever want call definitely obfuscates capacity see little actually changed,True Positive
cuanto cinismo cuanta doble moral diria el ñaño contagiosa ha sido la amnesia,False Negative
bitterselective amnesia real,True Negative
relevant delusion grandeur false belief ones superiority greatness intelligence link,True Positive
swear people literally kids narcissistic belief continuing bloodline false sense superiority bullies,True Positive
disorientation real,True Negative
nothing reorients quite like little disorientation,True Positive
predicting real world spatial disorientation alzheimers disease patients using virtual reality navigation tests,True Negative
confusion disorientation fear guilt amp relief emotions might feel part grief journey others may tell feeling angry example wrong instead find listeners accept feelings without condition,True Positive
rule every 15 days paleness disgust dizziness hair loss poor nutrition disorientation begin die also physically mentally nothing left,True Positive
problem fishoutofwater story answer want mc experience disorientation unfamiliar asian culture consider telling story via pov asian american asian canadian etc etcour diaspora vast see farewell3,False Negative
big thanks everyone came talk poster disorientation attacks csidh antsxv see poster paper coming soon,True Negative
mfs like whatre consequences going college orientation disorientation,False Negative
disorienation week york back help us spread word plan eventsubmissions due aug 17 disorientation week sept 2630 theme building cultures care,True Positive
disorientation destabilising society exactly aim woke,True Negative
go sleep vr disorientation waking w c k,False Negative
hold governors accountable actions outing lgbt student unfortunate effect student attempting self harm lord knows wish,True Positive
hes denying allegations racial slurs remember happened amzy photographer girl last year think people cautious lest blamed self harm may occur,True Positive
people ask isnt painful get tattoosbare mind suffer major depression anxiety including insomnia self harmthis therapy meif rich wouldnt even space,True Positive
twself harm told friends get laid instead calling bash man dick riding yknow repeatedly called white imitating white person cant tell tone 2 typos guess im latino enough,True Positive
id report like would threats selfharm certainly wouldnt cheerlead,True Negative
tw self harm im 2 months ahhh rhis farthest ive ever made ittt,True Positive
outsourcing self harm,True Positive
drinking much caffeine form self harm,True Positive
uh oh hope arent considering self harm,False Negative
went sandyford 24yearold woman long history depression anxiety selfharm alcohol abuse suicidal ideation,True Positive
month ago sed owsting pm middel cost living crysis huge acked self harm watt yew ive proved right yet knowwon listens ol soapy,True Negative
eine andere antwort habe ich nicht erwartet selbst meiner familie ging die aggression bei diskussionen immer von den braven nichthinterfragern aus,True Positive
listen pioneer nothing left lose passive aggression vol 1,False Negative
wonder u feel sorry someone made innocent remark oversight especially theres insult sarcasm expressed anyway understand aggression syndrome,True Positive
turkish aggression blue homeland creates answer transformation greece us base think prefer greece become us state instead islamic state greece belongs west,True Positive
coincidence either,False Negative
wants stop defending russian aggression also think part way cancel memberships today,True Positive
much attention russian crocodile tears nyt recent months despite fact russian aggression ukraine still ongoing,True Negative
aggression response verging threat makes believe,True Positive
articulate hell impressive hes 100 onto chinas aggression 1010,True Positive
stopped server mid shift educate prison industrial complex unwilling listen kept talking something called lunch rush sure means definitely said aggression feel unsafe arrested,True Positive
amhara elites territorial aggression oromia causing displacement millions oromos amp death thousands oromo lives matter,True Positive
deficits articulating issues nature evidentiarythe word reality relative term believe cant even discern well hostility people arises wrong political decisions affect individuals wellbeing childish,True Positive
partisan hostility rising 72 gop calls dems immoral new poll,True Positive
thats horrible ridiculous also different even 6 months ago something major shifted stopped caring nazi etc hostility amp threats even survey reporting satisfaction,True Positive
disappointment inevitable become discouraged theres choice make god would never discourage would always point trust therefore discouragement satan go emotions hostility god,True Positive
chronic black black hostility,True Positive
mom high standard decorum amp low tolerance children caught watching eyes gleaming hostility wilted became lifeless anemic amp limpa restrained small unthreatening thing longer anything,True Positive
hey man whats hapnin phil new dat told wasnt said dont come said phil philip told thats phil liar hey philip gim kiss baby hey phil phil whats wrong man whats hostility phil,True Positive
im like hostility coming,False Negative
collectivists feel crisis blind cause thus grabbing straws know theres rightwing demom laying waste ideology assume enemy human individualists clueless dumbfounded befuddled madness hostility,True Positive
trying web3 friend jesus whats hostility,False Negative
think tomorrows close going worth lot money,True Negative
absolutely didnt say suggest aew way perfect actually think something lull right concerned lack focus restraint reformatting show,True Negative
excellent points amp heart matter solution also canʻt echo lack restraint heated frenzied zeal punish someone without due process strikes schadenfreude pleasure suffering canʻt ethical condone,True Negative
plato democracy inevitably leads general lack restraint,True Negative
another sign improving employment economic conditions democrats unlike trumps 2017 tax cut lack serious spending restraint deficit debt soar national debt rose almost 78 trillion trumps time office,True Positive
slaves associate unwillingness slaves work master personal character flaws carnality lack selfrestraint thinking resembles masters critique slave labor think without recalling passage frederick douglass,False Negative
today gon na sore boobs elaines lack restraint,True Positive
gtsays interest gtlack self restraint shows 595sq 2 multis well least got something also np5 xu fu go first pretender even shes support lol time see,True Negative
think incredible talent charts amp technical analysis believe need stop trying character attacks well known investors undermines talent lack emotional restraint gain type tweet,True Negative
lack self control restraint inferior possess things,True Positive
yes raised good point submission strong opposition useful even ruling party good ruling party amp simply ruling party leader suffer lack restraint,True Negative
intellect pulls toward pleasing ideas unpleasing ideas repellent lack restraint monk,True Positive
look eyes ive seen exaggerated eyes incoherent speech like lot someone close life dont want accuse ive seen behaviors shes thin,True Positive
suggestion dementia biden unfounded trumps delivery speech could suggest rarely delivers anything rambling incoherent mess,True Positive
biden would seem like kindergarten always crapping pants incoherent speech staring space,True Positive
lack morals personal responsibility civilian world unnerving someone slap someone else speaking claim theyre victim speech thats incoherent incompetent,True Positive
ill take president donald trumps truthful forceful direct mode speech day barack hussein obamas carefully calibrated lies deceptions joe bidens detached utterly incoherent rambling dribble,True Positive
really shame missed every speech ive ever heard make sounds looks like confused thunderbird puppet almost totally incoherent completely touch reality im convinced shes fresh set childrens puppet show,True Positive
go wheel today give incoherent speech arent oh questions,True Positive
medical doctor please tell us tinubu hands legs shaking perhaps hes incoherent speech,True Positive
seen many videos speak deffo symptom cte speech incoherent almost time,True Negative
logorrhea cell mechanics excessive uncontrollable talking often highly incoherent logorrhea occurs states pathological excitement particularly manic phase manicdepressive psychosis one major symptoms pressure speech,True Positive
yer lucky cant anythin yer gon na mke cheeks hurt incoherent speech unfortunately taking punishment,True Positive
dr morris third presenter speaking operation warp speed impacts rapid development testing deployment methods,False Negative
found app unreliable rapid working arrived waited 10 minutes telephone speaking henrietta found rude argumentative loves speaking whilst complaint ref21933517,True Positive
got ta wear sunglasses inside show solidarity sunglass wearing profiles got ta make idiocy sound intelligent speaking rapidfire making nonsensical metaphors instead salient arguments,True Negative
honestly nothing tweet know ok lmao youre damn good writer feel every words feelings love insicurety taehyung thing right person wrong time experienced time yeah sadness everything,True Negative
even expartner exhibit abusive behaviors relationship theres possibility feelings anger sadness could lead abusive online technology amp social media create spaces abuse take place,True Positive
waske wane misplaced feelings sadness ngoku uelu hayi bawo,True Positive
realized uncool discuss pain feel walking away something wasnt meant wed rather talk giving bad bitch vibes actually bestie need confront feelings disappointment acknowledge sadness,True Positive
